{
    "title": "【Campus Screening Project】Beyond Beauty - Taiwan from Above 小小齊柏林·看見台灣校園公播計畫-從高空看見我們的家園",
    "timestamp": "1729395565",
    "url": "mail_display.php?timestamp=1729395565",
    "date": "2024/10/20 11:39",
    "department": "永續發展中心",
    "author": {
        "department": "永續發展中心",
        "name": "李莉莉 Li-Li Lee",
        "email": "lily@gms.ndhu.edu.tw",
        "phone": "03-890-5920"
    },
    "content": "\u003cdiv class=\"column1-unit\"\u003e\n\n\u003c!--  信件內容   --\u003e\n\u003cpre\u003e分類： 活動公告\n來源： 永續發展中心 - 李莉莉 Li-Li Lee - lily@gms.ndhu.edu.tw - 電話03-890-5920\n對象： 全校教職員_全校學生_休學學生_兼任教師_退休教職員_教職員眷屬\n標題： 【Campus Screening Project】Beyond Beauty - Taiwan from Above 小小齊柏林·看見台灣校園公播計畫-從高空看見我們的家園\n日期： Sun, 20 Oct 2024 11:39:25 +0800\n\u003c/pre\u003e\u003chr class=\"clear-contentunit\"/\u003e\u003cpre\u003eDear all,\n\nThe Climate Action Club of National Dong Hwa University (NDHU) and the Center for Sustainable Development, NDHU, cordially invite you to participate in the Campus Screening Project: Beyond Beauty – Taiwan from Above on Thursday, October 24, 2024, from 18:30 to 21:30 at Lecture Hall B119, College of Environmental Studies and Oceanography.\n\nThis event will take you on a visual journey exploring Taiwan’s stunning landscapes from the sky while addressing the environmental challenges the island faces. Following the screening, we will host a post-film discussion, conducted entirely in English and led by Professor Hsing-Sheng Tai from the Department of Natural Resources and Environmental Studies, where we will delve into Taiwan’s environmental issues and future strategies.\n\nEvent Schedule:\n18:20 – 18:30: Check-in and entry\n18:30 – 18:50: Event introduction\n18:50 – 20:30: Film screening\n20:30 – 21:30: Post-film discussion and group photo\nOrganizer: Chi Po-Lin Foundation and Climate Action Club, NDHU \nCo-organizer: Center for Sustainable Development, NDHU\nEvent Language: English \u0026amp; Chinese\n\nEvent Objectives:\n1. Raise Awareness of Environmental and Climate Change: Explore the beauty of Taiwan’s natural environment and the impacts of climate change while discussing land development and sustainable growth.\n2. Promote Climate Action on Campus: Inspire faculty and students to engage in sustainability initiatives and advocate for eco-friendly lifestyles.\n3. Create a Platform for Knowledge Sharing: The post-film discussion offers diverse perspectives, fostering a deeper connection between international students and Taiwanese culture.\n\nWe warmly welcome all faculty, students, and members of the public to join us in working toward environmental protection and sustainable development! If you have any questions, please don\u0026#39;t hesitate to contact the event coordinator.\n\nContact Person: Justin \nEmail: 411014321@gms.ndhu.edu.tw\nPhone: 0965-186506\n\nWe look forward to your participation!\n\n大家好，\n國立東華大學氣候行動社與永續發展中心誠摯邀請您參加，2024年10月24日（星期四）18:30-21:30 在環境暨海洋學院大樓B119講堂舉辦的【從高空看見我們的家園】校園公播計畫 - 放映《看見台灣》這部深具啟發性的紀錄片。\n\n這場活動不僅將帶領大家從高空探索臺灣的壯麗自然景觀，也將探討臺灣面臨的環境挑戰。放映結束後，特別邀請國立東華大學環境暨海洋學院自然資源與環境學系的戴興盛教授進行全英文的映後座談，與大家深入討論臺灣環境問題及未來對策。\n\n活動流程：\n\t•\t18:20 - 18:30: 報到與進場\n\t•\t18:30 - 18:50: 活動介紹\n\t•\t18:50 - 20:30: 影片放映\n\t•\t20:30 - 21:30: 映後座談與大合照\n\n活動目標：\n1.提高對環境與氣候變遷的認識：探索台灣的自然美景及氣候變遷的影響，並參與土地開發與永續發展的討論。\n2.推動校園內的氣候行動：激勵校內師生參與永續發展倡議，並倡導綠色生活方式。\n3.創造知識分享的平台： 映後座談提供多元觀點交流機會，促進外籍生與台灣文化的深度連結。\n\n主辦單位：看見齊柏林基金會、國立東華大學氣候行動社\n協辦單位：國立東華大學永續發展中心\n活動語言：英文 \u0026amp; 中文\n\n歡迎全校師生與各界人士踴躍參加，共同為環境保護與永續發展努力！\n若有任何問題，請聯繫活動負責人。\n\n聯絡人： 李鈺哲\n電子郵件： 411014321@gms.ndhu.edu.tw\n聯絡電話： 0965-186506\n\n李莉莉 Li-Li Lee\n國立東華大學 永續發展中心\nCenter for Sustainable Development\n電話 Tel：+886-3-890-5920\n電子郵件 E-mail：sd@gms.ndhu.edu.tw\n網址 Website：\u003ca href=\"https://sdgs.ndhu.edu.tw/\" target=\"_blank\"\u003ehttps://sdgs.ndhu.edu.tw/\u003c/a\u003e\u003c/pre\u003e\n\t\t\n\u003c/div\u003e",
    "attachments": [
        {
            "fileName": "https://sdgs.ndhu.edu.tw/",
            "fileSize": "Dear all,\n\nThe Climate Action Club of National Dong Hwa University (NDHU) and the Center for Sustainable Development, NDHU, cordially invite you to participate in the Campus Screening Project: Beyond Beauty – Taiwan from Above on Thursday, October 24, 2024, from 18:30 to 21:30 at Lecture Hall B119, College of Environmental Studies and Oceanography.\n\nThis event will take you on a visual journey exploring Taiwan’s stunning landscapes from the sky while addressing the environmental challenges the island faces. Following the screening, we will host a post-film discussion, conducted entirely in English and led by Professor Hsing-Sheng Tai from the Department of Natural Resources and Environmental Studies, where we will delve into Taiwan’s environmental issues and future strategies.\n\nEvent Schedule:\n18:20 – 18:30: Check-in and entry\n18:30 – 18:50: Event introduction\n18:50 – 20:30: Film screening\n20:30 – 21:30: Post-film discussion and group photo\nOrganizer: Chi Po-Lin Foundation and Climate Action Club, NDHU \nCo-organizer: Center for Sustainable Development, NDHU\nEvent Language: English \u0026 Chinese\n\nEvent Objectives:\n1. Raise Awareness of Environmental and Climate Change: Explore the beauty of Taiwan’s natural environment and the impacts of climate change while discussing land development and sustainable growth.\n2. Promote Climate Action on Campus: Inspire faculty and students to engage in sustainability initiatives and advocate for eco-friendly lifestyles.\n3. Create a Platform for Knowledge Sharing: The post-film discussion offers diverse perspectives, fostering a deeper connection between international students and Taiwanese culture.\n\nWe warmly welcome all faculty, students, and members of the public to join us in working toward environmental protection and sustainable development! If you have any questions, please don't hesitate to contact the event coordinator.\n\nContact Person: Justin \nEmail: 411014321@gms.ndhu.edu.tw\nPhone: 0965-186506\n\nWe look forward to your participation!\n\n大家好，\n國立東華大學氣候行動社與永續發展中心誠摯邀請您參加，2024年10月24日（星期四）18:30-21:30 在環境暨海洋學院大樓B119講堂舉辦的【從高空看見我們的家園】校園公播計畫 - 放映《看見台灣》這部深具啟發性的紀錄片。\n\n這場活動不僅將帶領大家從高空探索臺灣的壯麗自然景觀，也將探討臺灣面臨的環境挑戰。放映結束後，特別邀請國立東華大學環境暨海洋學院自然資源與環境學系的戴興盛教授進行全英文的映後座談，與大家深入討論臺灣環境問題及未來對策。\n\n活動流程：\n\t•\t18:20 - 18:30: 報到與進場\n\t•\t18:30 - 18:50: 活動介紹\n\t•\t18:50 - 20:30: 影片放映\n\t•\t20:30 - 21:30: 映後座談與大合照\n\n活動目標：\n1.提高對環境與氣候變遷的認識：探索台灣的自然美景及氣候變遷的影響，並參與土地開發與永續發展的討論。\n2.推動校園內的氣候行動：激勵校內師生參與永續發展倡議，並倡導綠色生活方式。\n3.創造知識分享的平台： 映後座談提供多元觀點交流機會，促進外籍生與台灣文化的深度連結。\n\n主辦單位：看見齊柏林基金會、國立東華大學氣候行動社\n協辦單位：國立東華大學永續發展中心\n活動語言：英文 \u0026 中文\n\n歡迎全校師生與各界人士踴躍參加，共同為環境保護與永續發展努力！\n若有任何問題，請聯繫活動負責人。\n\n聯絡人： 李鈺哲\n電子郵件： 411014321@gms.ndhu.edu.tw\n聯絡電話： 0965-186506\n\n李莉莉 Li-Li Lee\n國立東華大學 永續發展中心\nCenter for Sustainable Development\n電話 Tel：+886-3-890-5920\n電子郵件 E-mail：sd@gms.ndhu.edu.tw\n網址 Website：",
            "filePath": "https://sdgs.ndhu.edu.tw/",
            "thumbPath": null
        }
    ]
}